{
    "$schema": "../../helpers_headers/schemas/explorer_isa_schema.json",
    "compiler": {
        "id": "rv64-clang",
        "arch": "riscv",
        "label": "RISC-V 64 Clang",
        "base_flags": "-O3 -march=rv64gcv_zvl{simd_width}b -mrvv-vector-bits=zvl"
    },
    "description": "RISC-V Vector Extension (RVV 1.0 length-agnostic vector architecture)",
    "display_name": "RVV",
    "features": {
        "mode": "flags",
        "items": [
            { "id": "RVV", "label": "RVV 1.0", "define": "__riscv_v", "flag": "", "default": true, "locked": true, "description": "RISC-V Vector Extension 1.0" }
        ]
    },
    "headers": ["<riscv_vector.h>"],
    "name": "rvv",
    "order": 60
}
